{
  "schema_version": "paper_laya_decision_packet_batch_oracle_sealed_day_incomplete_rpc_v0",
  "type": "paper_batch",
  "id": "paper-laya-decision-packet-batch-oracle-sealed-day-incomplete-rpc-v0",
  "paper_only": true,
  "input": {
    "pipeline": [
      "paper_laya_precompute_decision_packet_v0",
      "paper_laya_decision_packet_scoreboard_sealed_fixture_v0"
    ],
    "local_json_only": true,
    "rpc": false,
    "observe_jsonl_tail": false,
    "host_extract_required": false,
    "host_jsonl_read": false,
    "marks_joined": false,
    "fixture_origin": "synthetic",
    "graph_policy": "cold",
    "days": [
      {
        "day": "2026-09-20",
        "manifest_name": "decision-day-2026-09-20.json",
        "manifest": {
          "schema_version": "paper_laya_decision_packet_batch_oracle_sealed_day_incomplete_rpc_v0",
          "fixture_kind": "decision_day_manifest",
          "origin": "synthetic",
          "day": "2026-09-20",
          "decision_packet_paths": [
            "fixtures/paper_laya_precompute_decision_packet_v0/decision_non_fill_sim_surround.json",
            "fixtures/paper_laya_precompute_decision_packet_v0/decision_fill_sim_surround.json",
            "fixtures/paper_laya_precompute_decision_packet_v0/decision_mixed_spines.json"
          ]
        },
        "expectation": {
          "schema_version": "paper_laya_decision_packet_scoreboard_sealed_fixture_v0",
          "fixture_kind": "sealed_day_expectation",
          "origin": "synthetic",
          "day": "2026-09-20",
          "sealed_book_rpc_slice": "incomplete",
          "closed_book_claim": false,
          "horizon_join": {
            "status": "fixture_joined_null_explicit",
            "values_supplied": false,
            "null_is_not_zero_return": true
          },
          "delta_exec_join": {
            "field": "delta_exec",
            "also_called": "Δ_exec",
            "value": null,
            "status": "fixture_joined_null_explicit",
            "reason": "laya_decision_packet_sealed_day_fixture_has_no_scored_fill",
            "null_is_not_zero_cost": true
          },
          "rows": [
            {
              "source_day": "2026-09-20",
              "spine_profile": "fill_sim_spine",
              "assembly_fingerprint": "fixtures/paper_laya_precompute_fill_sim_surround_packet_v0/mixed_scoreboard.json|fixtures/paper_laya_risk_gate_lock_receipt_v0/receipt_fill_sim_surround.json",
              "digest_n": 5,
              "digest_runner_n": 4,
              "digest_reject_n": 1,
              "risk_gate_decision": "locked"
            },
            {
              "source_day": "2026-09-20",
              "spine_profile": "mixed_spines",
              "assembly_fingerprint": "fixtures/paper_laya_precompute_fill_sim_surround_packet_v0/mixed_scoreboard.json|fixtures/paper_laya_precompute_surround_packet_v0/mixed_scoreboard.json|fixtures/paper_laya_risk_gate_lock_receipt_v0/receipt_fill_sim_surround.json|fixtures/paper_laya_risk_gate_lock_receipt_v0/receipt_non_fill_sim_surround.json",
              "digest_n": 10,
              "digest_runner_n": 8,
              "digest_reject_n": 2,
              "risk_gate_decision": "locked"
            },
            {
              "source_day": "2026-09-20",
              "spine_profile": "non_fill_sim_spine",
              "assembly_fingerprint": "fixtures/paper_laya_precompute_surround_packet_v0/mixed_scoreboard.json|fixtures/paper_laya_risk_gate_lock_receipt_v0/receipt_non_fill_sim_surround.json",
              "digest_n": 5,
              "digest_runner_n": 4,
              "digest_reject_n": 1,
              "risk_gate_decision": "locked"
            }
          ]
        }
      },
      {
        "day": "2026-09-21",
        "manifest_name": "decision-day-2026-09-21.json",
        "manifest": {
          "schema_version": "paper_laya_decision_packet_batch_oracle_sealed_day_incomplete_rpc_v0",
          "fixture_kind": "decision_day_manifest",
          "origin": "synthetic",
          "day": "2026-09-21",
          "decision_packet_paths": [
            "fixtures/paper_laya_precompute_decision_packet_v0/decision_non_fill_sim_surround.json",
            "fixtures/paper_laya_precompute_decision_packet_v0/decision_fill_sim_surround.json"
          ]
        },
        "expectation": {
          "schema_version": "paper_laya_decision_packet_scoreboard_sealed_fixture_v0",
          "fixture_kind": "sealed_day_expectation",
          "origin": "synthetic",
          "day": "2026-09-21",
          "sealed_book_rpc_slice": "incomplete",
          "closed_book_claim": false,
          "horizon_join": {
            "status": "fixture_joined_null_explicit",
            "values_supplied": false,
            "null_is_not_zero_return": true
          },
          "delta_exec_join": {
            "field": "delta_exec",
            "also_called": "Δ_exec",
            "value": null,
            "status": "fixture_joined_null_explicit",
            "reason": "laya_decision_packet_sealed_day_fixture_has_no_scored_fill",
            "null_is_not_zero_cost": true
          },
          "rows": [
            {
              "source_day": "2026-09-21",
              "spine_profile": "fill_sim_spine",
              "assembly_fingerprint": "fixtures/paper_laya_precompute_fill_sim_surround_packet_v0/mixed_scoreboard.json|fixtures/paper_laya_risk_gate_lock_receipt_v0/receipt_fill_sim_surround.json",
              "digest_n": 5,
              "digest_runner_n": 4,
              "digest_reject_n": 1,
              "risk_gate_decision": "locked"
            },
            {
              "source_day": "2026-09-21",
              "spine_profile": "non_fill_sim_spine",
              "assembly_fingerprint": "fixtures/paper_laya_precompute_surround_packet_v0/mixed_scoreboard.json|fixtures/paper_laya_risk_gate_lock_receipt_v0/receipt_non_fill_sim_surround.json",
              "digest_n": 5,
              "digest_runner_n": 4,
              "digest_reject_n": 1,
              "risk_gate_decision": "locked"
            }
          ]
        }
      }
    ]
  },
  "days": [
    {
      "day": "2026-09-20",
      "manifest_name": "decision-day-2026-09-20.json",
      "fixture_origin": "synthetic",
      "packet_census": {
        "listed_n": 3,
        "loaded_n": 3,
        "skipped_n": 0,
        "skip_is_not_a_dropped_spine_arm": true
      },
      "scoreboard": {
        "schema_version": "paper_laya_decision_packet_scoreboard_sealed_fixture_v0",
        "type": "paper_laya_decision_packet_scoreboard",
        "id": "paper-laya-decision-packet-scoreboard-sealed-fixture-v0",
        "paper_only": true,
        "laya": {
          "authorize_run": false,
          "risk_gate_unlock": false,
          "live_trading": false,
          "consumption": "fixtures_only_decision_packet_scoreboard_v0"
        },
        "risk_gate": {
          "decision": "locked",
          "unlock": false,
          "reason": "paper_registration_fixture_scoreboard_not_risk_gate_unlock"
        },
        "input": {
          "contract": "paper_laya_precompute_decision_packet_v0",
          "local_json_only": true,
          "rpc": false,
          "observe_jsonl_tail": false,
          "host_extract_required": false,
          "host_jsonl_read": false,
          "marks_joined": false,
          "fixture_side": "sealed_day_checked_in",
          "packets": [
            {
              "schema_version": "paper_laya_precompute_decision_packet_v0",
              "type": "paper_laya_precompute_decision_packet",
              "id": "paper-laya-precompute-decision-packet-v0",
              "paper_only": true,
              "packet_kind": "decision",
              "laya": {
                "authorize_run": false,
                "risk_gate_unlock": false,
                "live_trading": false,
                "consumption": "fixtures_only_decision_packet_v0"
              },
              "risk_gate": {
                "decision": "locked",
                "unlock": false,
                "reason": "paper_registration_fixture_decision_packet_not_risk_gate_unlock"
              },
              "input": {
                "local_json_only": true,
                "rpc": false,
                "observe_jsonl_tail": false,
                "host_extract_required": false,
                "host_jsonl_read": false,
                "marks_joined": false,
                "fixture_origin": "synthetic",
                "graph_policy": "cold",
                "assembly": {
                  "surround_paths": [
                    "fixtures/paper_laya_precompute_fill_sim_surround_packet_v0/mixed_scoreboard.json"
                  ],
                  "lock_receipt_paths": [
                    "fixtures/paper_laya_risk_gate_lock_receipt_v0/receipt_fill_sim_surround.json"
                  ]
                }
              },
              "surround_citations": [
                {
                  "registration": {
                    "id": "paper-laya-precompute-fill-sim-surround-packet-v0",
                    "schema_version": "paper_laya_precompute_fill_sim_surround_packet_v0",
                    "pull_request": 63,
                    "commit": "171cd61",
                    "rewritten_by_this_stamp": false
                  },
                  "fixture_path": "fixtures/paper_laya_precompute_fill_sim_surround_packet_v0/mixed_scoreboard.json",
                  "validated_by_parent_cli": true,
                  "surround_body_embedded": false,
                  "digest": {
                    "counts_are_stamp_counts_not_returns": true,
                    "full_book": {
                      "policy": "dec007_both_arms_retained",
                      "reject_stamps_dropped": 0,
                      "n": 5,
                      "runner_n": 4,
                      "reject_n": 1
                    },
                    "label_rates": {
                      "share_kind": "count_fraction_not_a_return",